,Title,Content,Cluster
157,illegal purchase bid property offered sale authority public servant, sale property held lawful authority public servant purchases bids property account  whether knows legal incapacity purchase property sale bids property not intending perform obligations lays bidding  punished imprisonment either description term may extend one month fine may extend two hundred taka,7
158,obstructing public servant discharge public functions, voluntarily obstructs public servant discharge public functions  punished imprisonment either description term may extend three months fine may extend five hundred taka,6
159,omission assist public servant bound law give assistance, bound law render furnish assistance public servant execution public duty intentionally omits give assistance  punished simple imprisonment term may extend one month fine may extend two hundred taka assistance demanded public servant legally competent make demand purposes executing process lawfully issued court justice preventing commission offence suppressing riot affray apprehending  charged guilty offence escaped lawful custody  punished simple imprisonment term may extend six months fine may extend five hundred taka,1
160,disobedience order duly promulgated public servant, knowing order promulgated public servant lawfully empowered promulgate order directed abstain certain act take certain order certain property possession management disobeys direction  disobedience causes tends cause obstruction annoyance injury risk obstruction annoyance injury s lawfully employed punished simple imprisonment term may extend one month fine may extend two hundred taka disobedience causes tends cause danger human life health safety causes tends cause riot affray  punished imprisonment either description term may extend six months fine may extend one thousand taka,4
161,threat injury public servant, holds threat injury public servant  believes public servant interested purpose inducing public servant act forbear delay act connected exercise public functions public servant  punished imprisonment either description term may extend two years fine,6
162,threat injury induce person refrain applying protection public servant, holds threat injury  purpose inducing  refrain desist making legal application protection injury public servant legally empowered give protection cause protection given  punished imprisonment either description term may extend one year fine,4
163,giving fabricating false evidence intent procure conviction offence punishable imprisonment life imprisonment, gives fabricates false evidence intending thereby cause knowing likely thereby cause  convicted offence law time force not capital punishable imprisonment life imprisonment term seven years upwards  punished  convicted offence would liable punished,5
164,using evidence known false, corruptly uses attempts use true genuine evidence evidence knows false fabricated  punished manner gave fabricated false evidence,1
165,issuing signing false certificate, issues signs certificate required law given signed relating fact certificate law admissible evidence knowing believing certificate false material point  punished manner gave false evidence,1
166,punishment false evidence, intentionally gives false evidence stage judicial proceeding fabricates false evidence purpose used stage judicial proceeding  punished imprisonment either description term may extend seven years  also liable fine  intentionally gives fabricates false evidence case  punished imprisonment either description term may extend three years  also liable fine,1
167,giving fabricating false evidence intent procure conviction capital offence innocent person thereby convicted executed, gives fabricates false evidence intending thereby cause knowing likely thereby cause  convicted offence capital law time force  punished imprisonment life rigorous imprisonment term may extend ten years  also liable fine innocent  convicted executed consequence false evidence  gives false evidence  punished either death punishment herein described,1
168,using true certificate known false, corruptly uses attempts use certificate true certificate knowing false material point  punished manner gave false evidence,1
169,false statement made declaration law receivable evidence, declaration made subscribed declaration court justice public servant s bound authorized law receive evidence fact makes statement false either knows believes false not believe true touching point material object declaration made used  punished manner gave false evidence,1
170,using true declaration knowing false, corruptly uses attempts use true declaration knowing false material point  punished manner gave false evidence,1
171,causing disappearance evidence offence giving false information screen offender capital offence punishable imprisonment life punishable less ten years imprisonment, knowing reason believe offence committed causes evidence commission offence disappear intention screening offender legal punishment intention gives information respecting offence knows believes false  offence knows believes committed punishable death punished imprisonment either description term may extend seven years  also liable fine offence punishable imprisonment life imprisonment may extend ten years  punished imprisonment either description term may extend three years  also liable fine offence punishable imprisonment term not extending ten years  punished imprisonment description provided offence term may extend onefourth part longest term imprisonment provided offence fine,5
172,intentional omission give information offence person bound inform, knowing reason believe offence committed intentionally omits give information respecting offence legally bound give  punished imprisonment either description term may extend six months fine,1
173,giving false information respecting offence committed, knowing reason believe offence committed gives information respecting offence knows believes false  punished imprisonment either description term may extend two years fine,1
174,destruction document prevent production evidence, secrets destroys document may lawfully compelled produce evidence court justice proceeding lawfully held public servant obliterates renders illegible whole part document intention preventing produced used evidence court public servant aforesaid  lawfully summoned required produce purpose  punished imprisonment either description term may extend two years fine,1
175,false personation purpose act proceeding suit prosecution, falsely ates another assumed character makes admission statement confesses judgment causes process issued becomes bail security act suit criminal prosecution  punished imprisonment either description term may extend three years fine,7
176,fraudulent removal concealment property prevent seizure forfeited execution, fraudulently removes conceals transfers delivers  property interest therein intending thereby prevent property interest therein taken forfeiture satisfaction fine sentence pronounced knows likely pronounced court justice competent authority taken execution decree order made knows likely made court justice civil suit  punished imprisonment either description term may extend two years fine,4
177,fraudulent claim property prevent seizure forfeited execution, fraudulently accepts receives claims property interest therein knowing right rightful claim property interest practices deception touching right property interest therein intending thereby prevent property interest therein taken forfeiture satisfaction fine sentence pronounced knows likely pronounced court justice competent authority taken execution decree order made knows likely made court justice civil suit  punished imprisonment either description term may extend two years fine,4
178,taking gift help recover stolen property etc, takes agrees consents take gratification pretence account helping  recover moveable property  deprived offence punishable code  unless uses means power cause offender apprehended convicted offence punished imprisonment either description term may extend two years fine,5
179,dishonestly making false claim court, fraudulently dishonestly intent injure annoy  makes court justice claim knows false  punished imprisonment either description term may extend two years  also liable fine,1
180,punishment undue influence personation election, commits offence undue influence ation election  punished imprisonment either description term may extend one year fine,5
181,false statement connection election, intent affect result election makes publishes statement purporting statement fact false either knows believes not believe true relation al character conduct candidate  punished fine,1
182,illegal payments connection election, without general special authority writing candidate incurs authorises expenses account holding public meeting upon advertisement circular publication way whatsoever purpose promoting procuring election candidate  punished fine may extend five hundred taka provided  incurred expenses not exceeding amount ten taka without authority obtains within ten days date expenses incurred approval writing candidate  deemed incurred expenses authority candidate,7
183,failure keep election accounts, required law time force rule force law keep accounts expenses incurred connection election fails keep accounts  punished fine may extend five hundred taka,1
184,punishment bribery election, commits offence bribery  punished imprisonment either description term may extend one year fine provided bribery treating  punished fine,7
185,making selling instrument counterfeiting coin, makes mends performs part process making mending buys sells disposes die instrument purpose used knowing reason believe intended used purpose counterfeiting coin  punished imprisonment either description term may extend three years  also liable fine,0
186,making selling instrument counterfeiting bangladesh coin, makes mends performs part process making mending buys sells disposes die instrument purpose used knowing reason believe intended used purpose counterfeiting bangladesh coin  punished imprisonment either description term may extend seven years  also liable fine,0
187,possession instrument material purpose using counterfeiting coin bangladesh coin, possession instrument material purpose using counterfeiting coin knowing reason believe intended used purpose  punished imprisonment either description term may extend three years  also liable fine coin counterfeited bangladesh coin  punished imprisonment either description term may extend ten years  also liable fine,0
188,abetting bangladesh counterfeiting bangladesh coin, within bangladesh abets counterfeiting coin bangladesh  punished manner abetted counterfeiting coin within bangladesh,3
189,counterfeiting bangladesh coin, counterfeits knowingly performs part process counterfeiting bangladesh coin  punished imprisonment life imprisonment either description term may extend ten years  also liable fine,2
190,import export counterfeit coin, imports bangladesh exports therefrom counterfeit coin knowingly reason believe counterfeit  punished imprisonment either description term may extend three years  also liable fine,0
191,fraudulently dishonestly diminishing weight altering composition bangladesh coin, fraudulently dishonestly performs bangladesh coin operation diminishes weight alters composition coin  punished imprisonment either description term may extend seven years  also liable fine,7
192,counterfeiting government stamp, counterfeits knowingly performs part process counterfeiting stamp issued government purpose revenue  punished imprisonment life imprisonment either description term may extend ten years  also liable fine,2
193,possession counterfeit government stamp, possession stamp knows counterfeit stamp issued government purpose revenue intending use dispose genuine stamp order may used genuine stamp  punished imprisonment either description term may extend seven years  also liable fine,1
194,making selling instrument counterfeiting government stamp, makes performs part process making buys sells disposes instrument purpose used knowing reason believe intended used purpose counterfeiting stamp issued government purpose revenue  punished imprisonment either description term may extend seven years  also liable fine,0
195,adulteration food drink intended sale, adulterates article food drink make article noxious food drink intending sell article food drink knowing likely sold food drink  punished imprisonment either description term may extend six months fine may extend one thousand taka,7
196,punishment theft, commits theft  punished imprisonment either description term may extend three years fine,7
197,theft dwellinghouse etc, commits theft building tent vessel building tent vessel used human dwelling use custody property  punished imprisonment either description term may extend seven years  also liable fine,4
198,theft preparation made causing death hurt restraint order committing theft, commits theft made preparation causing death hurt restraint fear death hurt restraint  order committing theft order effecting escape committing theft order retaining property taken theft  punished rigorous imprisonment term may extend ten years  also liable fine,4
199,theft clerk servant property possession master, clerk servant employed capacity clerk servant commits theft respect property possession master employer  punished imprisonment either description term may extend seven years  also liable fine,6
