,Title,Content,Cluster
72,public servant unlawfully buying bidding property, public servant legally bound public servant not purchase bid certain property purchases bids property either name name another jointly shares others  punished simple imprisonment term may extend two years fine property purchased  confiscated,1
73,personating public servant, pretends hold particular office public servant knowing not hold office falsely ates  holding office assumed character attempts act colour office  punished imprisonment either description term may extend two years fine,2
74,wearing garb carrying token used public servant fraudulent intent, not belonging certain class public servants wears garb carries token resembling garb token used class public servants intention may believed knowledge likely believed belongs class public servants  punished imprisonment either description term may extend three months fine may extend two hundred taka,3
75,injuring defiling place worship intent insult religion class, destroys damages defiles place worship object held sacred class s intention thereby insulting religion class s knowledge class s likely consider destruction damage defilement insult religion  punished imprisonment either description term may extend two years fine,3
76,deliberate malicious acts intended outrage religious feelings class insulting religion religious beliefs, deliberate malicious intention outraging religious feelings class citizens bangladesh words either spoken written visible representations insults attempts insult religion religious beliefs class  punished imprisonment either description term may extend two years fine,3
77,disturbing religious assembly, voluntarily causes disturbance assembly lawfully engaged performance religious worship religious ceremonies  punished imprisonment either description term may extend one year fine,3
78,trespassing burial places etc, intention wounding feelings  insulting religion  knowledge feelings  likely wounded religion  likely insulted thereby commits trespass place worship place sepulture place set apart performance funeral rites depository remains dead offers indignity human corpse causes disturbance s assembled performance funeral ceremonies  punished imprisonment either description term may extend one year fine,3
79,uttering words etc deliberate intent wound religious feelings, deliberate intention wounding religious feelings  utters word makes sound hearing  makes gesture sight  places object sight   punished imprisonment either description term may extend one year fine,3
80,punishment murder, commits murder  punished death imprisonment life  also liable fine,2
81,causing death rash driving riding public way, causes death  rash negligent driving vehicle riding public way not amounting culpable homicide  punished imprisonment either description term may extend three years fine,4
82,abetment suicide child insane person, eighteen years age insane  delirious  idiot  state intoxication commits suicide  abets commission suicide  punished death imprisonment life imprisonment term not exceeding ten years  also liable fine,2
83,punishment murder lifeconvict, sentence imprisonment life commits murder  punished death,2
84,punishment culpable homicide not amounting murder, commits culpable homicide not amounting murder  punished imprisonment life imprisonment either description term may extend ten years  also liable fine act death caused done intention causing death causing bodily injury likely cause death imprisonment either description term may extend ten years fine act done knowledge likely cause death without intention cause death cause bodily injury likely cause death,4
85,causing death negligence, causes death  rash negligent act not amounting culpable homicide  punished imprisonment either description term may extend five years fine,4
86,abetment suicide child insane person, commits suicide  abets commission suicide  punished imprisonment either description term may extend ten years  also liable fine,2
87,attempt murder attempts lifeconvicts, act intention knowledge circumstances act caused death would guilty murder  punished imprisonment either description term may extend ten years  also liable fine hurt caused  act offender  liable either imprisonment life punishment hereinbefore mentioned  offending section sentence imprisonment life may hurt caused punished death,2
88,attempt commit culpable homicide, act intention knowledge circumstances act caused death would guilty culpable homicide not amounting murder  punished imprisonment either description term may extend three years fine hurt caused  act  punished imprisonment either description term may extend seven years fine,2
89,attempt commit suicide, attempts commit suicide act towards commission offence  punished simple imprisonment term may extend one year fine,5
90,punishment ausing miscarriage, voluntarily causes woman child miscarry  miscarriage not caused good faith purpose saving life woman punished imprisonment either description term may extend three years fine woman quick child  punished imprisonment either description term may extend seven years  also liable fine,4
91,punishment causing miscarriage without women consent, commits offence defined last preceding section without consent woman whether woman quick child not  punished imprisonment life imprisonment either description term may extend ten years  also liable fine,5
92,death caused act done intent cause miscarriage, intent cause miscarriage woman child act causes death woman  punished imprisonment either description term may extend ten years  also liable fine,4
93,act done intent prevent child born alive cause die birth, birth child act intention thereby preventing child born alive causing die birth act prevent child born alive causes die birth  act not caused good faith purpose saving life mother punished imprisonment either description term may extend ten years fine,4
94,causing death quick unborn child act amounting culpable homicide, act circumstances thereby caused death would guilty culpable homicide act cause death quick unborn child  punished imprisonment either description term may extend ten years  also liable fine,4
95,exposure abandonment child twelve years parent person care, father mother child age twelve years care child  expose leave child place intention wholly abandoning child  punished imprisonment either description term may extend seven years fine section not intended prevent trial offender murder culpable homicide case may child die consequence exposure,4
96,concealment birth secret disposal dead body, secretly burying otherwise disposing dead body child whether child die birth intentionally conceals endeavours conceal birth child  punished imprisonment either description term may extend two years fine,4
97,punishment voluntarily causing hurt, except case provided section voluntarily causes hurt  punished imprisonment either description term may extend one year fine may extend one thousand taka,7
98,voluntarily causing hurt dangerous weapons means, except case provided section voluntarily causes hurt means instrument shooting stabbing cutting instrument used weapon offence likely cause death means fire heated substance means poison corrosive substance means explosive substance means substance deleterious human body inhale swallow receive blood means animal  punished imprisonment either description term may extend three years fine,7
99,punishment voluntarily causing grievous hurt, except case provided section voluntarily causes grievous hurt  punished imprisonment either description term may extend seven years  also liable fine,7
100,voluntarily causing grievous hurt dangerous weapons means, except case provided section voluntarily causes grievous hurt means instrument shooting stabbing cutting instrument used weapon offence likely cause death means fire heated substance means poison corrosive substance means explosive substance means substance deleterious human body inhale swallow receive blood means animal  punished imprisonment life imprisonment either description term may extend ten years  also liable fine,7
101,voluntarily causing grievous hurt respect eyes hand face means corrosive substance etc, except case provided section voluntarily causes grievous hurt kind mentioned clause secondly section respect eyes either gouging means corrosive substance b clause sixthly section means corrosive substance  punished death imprisonment life  also liable fine,7
102,voluntarily causing hurt extort property constrain illegal act, voluntarily causes hurt purpose extorting sufferer  interested sufferer property valuable security constraining sufferer  interested sufferer anything illegal may facilitate commission offence  punished imprisonment either description term may extend ten years  also liable fine,7
103,causing hurt means poison etc intent commit offence, administers causes taken  poison stupefying intoxicating un wholesome drug thing intent cause hurt  intent commit facilitate commission offence knowing likely thereby cause hurt  punished imprisonment either description term may extend ten years  also liable fine,4
104,voluntarily causing grievous hurt extort property constrain illegal act, voluntarily causes grievous hurt purpose extorting sufferer  interested sufferer property valuable security constraining sufferer  interested sufferer anything illegal may facilitate commission offence  punished imprisonment life imprisonment either description term may extend ten years  also liable fine,7
105,voluntarily causing hurt extort confession compel restoration property, voluntarily causes hurt purpose extorting sufferer  interested sufferer confession information may lead detection offence misconduct purpose constraining sufferer  interested sufferer restore cause restoration property valuable security satisfy claim demand give information may lead restoration property valuable security  punished imprisonment either description term may extend seven years  also liable fine,7
106,voluntarily causing hurt deter public servant duty, voluntarily causes hurt  public servant discharge duty public servant intent prevent deter  public servant discharging duty public servant consequence anything done attempted done  lawful discharge duty public servant  punished imprisonment either description term may extend three years fine,6
107,voluntarily causing grievous hurt deter public servant duty, voluntarily causes grievous hurt  public servant discharge duty public servant intent prevent deter  public servant discharging duty public servant consequence anything done attempted done  lawful discharge duty public servant  punished imprisonment either description term may extend ten years  also liable fine,6
108,voluntarily causing hurt provocation, voluntarily causes hurt grave sudden provocation neither intends knows likely cause hurt   gave provocation  punished imprisonment either description term may extend one month fine may extend five hundred taka,7
109,voluntarily causing grievous hurt provocation, voluntarily causes grievous hurt grave sudden provocation neither intends knows likely cause grievous hurt   gave provocation  punished imprisonment either description term may extend four years fine may extend two thousand taka,7
110,act endangering life personal safety others, act rashly negligently endanger human life al safety others  punished imprisonment either description term may extend three months fine may extend two hundred fifty taka,7
111,causing hurt act endangering life personal safety others, causes hurt  act rashly negligently endanger human life al safety others  punished imprisonment either description term may extend six months fine may extend five hundred taka,7
112,causing grievous hurt act endangering life personal safety others, causes grievous hurt  act rashly negligently endanger human life al safety others  punished imprisonment either description term may extent two years fine may extend five thousand taka,7
113,causing grievous hurt rush driving riding public way, causes grievous hurt  driving vehicle riding public way rashly negligently endanger human life al safety others  punished imprisonment either description term may extend two years fine,7
114,wrongful confinement ten days, wrongfully confines  ten days  punished imprisonment either description term may extend three years  also liable fine,6
115,wrongful confinement person whose liberation writ issued, keeps  wrongful confinement knowing writ liberation  duly issued  punished imprisonment either description term may extend two years addition term imprisonment may liable section chapter,6
116,wrongful confinement secret, wrongfully confines  manner indicate intention confinement  may not known  interested  confined public servant place confinement may not known discovered  public servant hereinbefore mentioned  punished imprisonment either description term may extend two years addition punishment may liable wrongful confinement,6
117,wrongful confinement extort property constrain illegal act, wrongfully confines  purpose extorting  confined  interested  confined property valuable security constraining  confined  interested  anything illegal give information may facilitate commission offence  punished imprisonment either description term may extend three years  also liable fine,6
118,wrongful confinement extort confession compel restoration property, wrongfully confines  purpose extorting  confined  interested  confined confession information may lead detection offence misconduct purpose constraining  confined  interested  confined restore cause restoration property valuable security satisfy claim demand give information may lead restoration property valuable security  punished imprisonment either description term may extend three years  also liable fine,6
119,punishment wrongful confinement, wrongfully confines   punished imprisonment either description term may extend one year fine may extend one thousand taka,7
120,wrongful confinement three days, wrongfully confines  three days  punished imprisonment either description term may extend two years fine,6
121,punishment wrongful restraint, wrongfully restrains   punished simple imprisonment term may extend one month fine may extend five hundred taka,7
122,punishment assault criminal force otherwise grave provocation, assaults uses criminal force  otherwise grave sudden provocation given   punished imprisonment either description term may extend three months fine may extend five hundred taka explanation grave sudden provocation not mitigate punishment offence section provocation sought voluntarily provoked offender excuse offence provocation given anything done obedience law public servant lawful exercise powers public servant provocation given anything done lawful exercise right private defence whether provocation grave sudden enough mitigate offence question fact,7
123,assault criminal force deter public servant discharge duty, assaults uses criminal force  public servant execution duty public servant intent prevent deter  discharging duty public servant consequence anything done attempted done  lawful discharge duty public servant  punished imprisonment either description term may extend three years fine,6
124,assault criminal force woman intent outage modesty, assaults uses criminal force woman intending outrage knowing likely thereby outrage modesty  punished imprisonment either description term may extend two years fine,4
125,assault criminal force intent dishonour person otherwise grave provocation, assaults uses criminal force  intending thereby dishonour  otherwise grave sudden provocation given   punished imprisonment either description term may extend two years fine,7
126,assault criminal force attempt commit theft property carried person, assaults uses criminal force  attempting commit theft property  wearing carrying  punished imprisonment either description term may extent two years fine,7
127,assault criminal force attempt wrongfully confine person, assaults uses criminal force  attempting wrongfully confine   punished imprisonment either description term may extend one year fine may extend one thousand taka,7
128,assault criminal force grave provocation, assaults uses criminal force  grave sudden provocation given   punished simple imprisonment term may extend one month fine may extend two hundred taka,7
129,punishment kidnapping, kidnaps  bangladesh lawful guardianship  punished imprisonment either description term may extend seven years  also liable fine,7
130,kidnapping abducting order murder, kidnaps abducts  order  may murdered may disposed put danger murdered  punished imprisonment life rigorous imprisonment term may extend ten years  also liable fine,2
131,kidnapping abducting person age ten, kidnaps abducts  age ten order  may murdered subjected grievous hurt slavery lust  may disposed put danger murdered subjected grievous hurt slavery lust   punished death imprisonment life rigorous imprisonment term may extend fourteen years  not less seven years,2
132,kidnapping abducting intent secretly wrongfully confine person, kidnaps abducts  intent cause  secretly wrongfully confined  punished imprisonment either description term may extend seven years  also liable fine,4
133,kidnapping abducting inducing woman compel marriage etc, kidnaps abducts woman intent may compelled knowing likely compelled marry  order may forced seduced illicit intercourse knowing likely forced seduced illicit intercourse  punished imprisonment either description term may extend ten years  also liable fine  means criminal intimidation defined code abuse authority method compulsion induces woman go place intent may knowing likely forced seduced illicit intercourse another   also punishable aforesaid,4
134,kidnapping abducting child ten years intent steal person, kidnaps abducts child age ten years intention taking dishonestly moveable property  child  punished imprisonment either description term may extend seven years  also liable fine,4
135,buying disposing person slave, imports exports removes buys sells disposes  slave accepts receives detains  slave  punished imprisonment either description term may extend seven years  also liable fine,0
136,habitual dealing slaves, habitually imports exports removes buys sells traffics deals slaves  punished imprisonment life imprisonment either description term not exceeding ten years  also liable fine,0
137,selling minor purposes prostitution etc, sells lets hire otherwise disposes  age eighteen years intent   age employed used purpose prostitution illicit intercourse  unlawful immoral purpose knowing likely  age employed used purpose  punished imprisonment either description term may extend ten years  also liable fine selling minor purposes prostitution etc,0
138,buying minor purposes prostitution etc, buys hires otherwise obtains possession  age eighteen years intent   age employed used purpose prostitution illicit intercourse  unlawful immoral purpose knowing likely  age employed used purpose  punished imprisonment either description term may extend ten years  also liable fine,0
139,unlawful compulsory labour, unlawfully compels  labour   punished imprisonment either description term may extend one year fine  compels prisoner war protected  serve armed forces bangladesh  punished imprisonment either description term may extend one year,7
140,procuration minor girl, means whatsoever induces minor girl age eighteen years go place act intent girl may knowing likely forced seduced illicit intercourse another   punishable imprisonment may extend ten years  also liable fine,4
141,importation girl foreign country, imports bangladesh country outside bangladesh girl age twentyone years intent may knowing likely forced seduced illicit intercourse another   punishable imprisonment may extend ten years  also liable fine,0
142,kidnapping abducting order subject person grievous hurt slavery etc, kidnaps abducts  order  may subjected may disposed put danger subjected grievous hurt slavery unnatural lust  knowing likely  subjected disposed  punished imprisonment either description term may extend ten years  also liable fine,7
143,wrongfully concealing keeping confinement kidnapped abducted person, knowing  kidnapped abducted wrongfully conceals confines   punished manner kidnapped abducted  intention knowledge purpose conceals detains  confinement,6
144,absconding avoid service summons proceeding, absconds order avoid served summons notice order proceeding public servant legally competent public servant issue summons notice order  punished simple imprisonment term may extend one month fine may extend five hundred taka summons notice order attend  agent produce document court justice simple imprisonment term may extend six month fine may extend one thousand taka,1
145,preventing service summons proceeding preventing publication thereof, manner intentionally prevents serving  summons notice order proceeding public servant legally competent public servant issue summons notice order intentionally prevents lawful affixing place summons notice order intentionally removes summons notice order place lawfully affixed intentionally prevents lawful making proclamation authority public servant legally competent public servant direct proclamation made  punished simple imprisonment term may extend one month fine may extend five hundred taka summons notice order proclamation attend  agent produce document court justice simple imprisonment term may extend six months fine may extend one thousand taka,1
146,nonattendance obedience order public servant, legally bound attend  agent certain place time obedience summons notice order proclamation proceeding public servant legally competent public servant issue intentionally omits attend place time departs place bound attend time lawful depart  punished simple imprisonment term may extend one month fine may extend five hundred taka summons notice order proclamation attend  agent court justice simple imprisonment term may extend six months fine may extend one thousand taka,1
147,omission produce document public servant person legally bound produce, legally bound produce deliver document public servant intentionally omits produce deliver  punished simple imprisonment term may extend one month fine may extend five hundred taka document produced delivered court justice simple imprisonment term may extend six months fine may extend one thousand taka,1
148,omission give notice information public servant person legally bound give, legally bound give notice furnish information subject public servant intentionally omits give notice furnish information manner time required law  punished simple imprisonment term may extend one month fine may extend five hundred taka notice information required given respects commission offence required purpose preventing commission offence order apprehension offender simple imprisonment term may extend six months fine may extend one thousand taka notice information required given required order passed subsection section code criminal procedure imprisonment either description term may extend six months fine may extend one thousand taka,1
149,furnishing false information, legally bound furnish information subject public servant furnishes true information subject knows reason believe false  punished simple imprisonment term may extend six months fine may extend one thousand taka information legally bound give respects commission offence required purpose preventing commission offence order apprehension offender imprisonment either description term may extend two years fine,1
150,refusing oath affirmation duly required public servant make, refuses bind oath affirmation state truth required bind public servant legally competent require  bind  punished simple imprisonment term may extend six months fine may extend one thousand taka,1
151,refusing answer public servant authorized question, legally bound state truth subject public servant refuses answer question demanded touching subject public servant exercise legal powers public servant  punished simple imprisonment term may extend six months fine may extend one thousand taka,1
152,refusing sign statement, refuses sign statement made required sign statement public servant legally competent require  sign statement  punished simple imprisonment term may extend three months fine may extend five hundred taka,1
153,false statement oath affirmation public servant person authorized administer oath affirmation, legally bound oath affirmation state truth subject public servant  authorized law administer oath affirmation makes public servant  aforesaid touching subject statement false either knows believes false not believe true  punished imprisonment either description term may extend three years  also liable fine,1
154,false information intent cause public servant use lawful power injury another person, gives public servant information knows believes false intending thereby cause knowing likely thereby cause public omit anything public servant ought not omit true state facts respecting information given known b use lawful power public servant injury annoyance   punished imprisonment either description term may extend six months fine may extend one thousand taka,1
155,resistance taking property lawful authority public servant, offers resistance taking property lawful authority public servant knowing reason believe public servant  punished imprisonment either description term may extend six months fine may extend one thousand taka,1
156,obstructing sale property offered sale authority public servant, intentionally obstructs sale property offered sale lawful authority public servant  punished imprisonment either description term may extend one month fine may extend five hundred taka,7
